{
  "ticket_id": "{{TICKET_ID}}",
  "ticket_title": "{{TICKET_TITLE}}",
  "ticket_url": null,
  "ticket_description": null,
  "ticket_tags": [],
  "ticket_type": null,
  "ticket_priority": null,
  "feature_dir": "features/{{TICKET_ID}}",
  "workflow": "{{WORKFLOW}}",
  "workflow_matched_rule": null,
  "current_node": "brainstorm",
  "status": "in_progress",
  "trigger": "manual",
  "started_at": "{{TIMESTAMP}}",
  "updated_at": "{{TIMESTAMP}}",
  "completed_at": null,
  "skipped_nodes": [],
  "review_rounds": {
    "plan": 0,
    "spec": 0,
    "code": 0
  },
  "tasks": {
    "total": 0,
    "completed": 0,
    "in_progress": 0,
    "failed": 0,
    "items": []
  },
  "metrics": {
    "phases": {},
    "bugs_found": 0,
    "bugs_fixed": 0,
    "first_pass_code_review": null,
    "perf_findings": {
      "critical": 0,
      "warning": 0,
      "info": 0
    }
  },
  "docs": {
    "changelog_updated": false,
    "files_updated": []
  },
  "pr": {
    "url": null,
    "branch": null,
    "platform": null,
    "status": null
  },
  "escalation": {
    "active": false,
    "reason": null,
    "node": null,
    "at": null
  },
  "notifications_sent": [],
  "history": []
}
